47858	Japanese Schools Tracking Students by Radio TOKYO (AP) -- Cutting class just got harder but schools are safer thanks to computer chips that help track students  Japanese officials say.    Some schools here this month began trial runs in which students carry chips that have tiny antennae and can be traced by radio  with some of the kids attaching the tags to their backpacks...	1	Sci/Tech
66316	The Toy War Begins Erika  the latest offering from the Barbie franchise  wears a blue peasant dress and flowered headband. She carries a small plastic cat  plus a set of Barbie essentials: a comb  brush  mirror and perfume bottle.	0	Business
65094	Ferrero leads Spanish slump in Madrid Holder Juan Carlos Ferrero has suffered a 6-3  6-1 setback against a Peruvian with a bad ankle  crashing out listlessly in his opening match at the Madrid Masters.	2	Sports
86671	Pakistan Cricket mania fails to grip Lahorities LAHORE: Unlike the Pakistan-India historic cricket series  there is less public interest in the two back to back matches of the tri-national cricket series between Pakistan and Sri Lanka being played at Gadaffi stadium on Thursday and Saturday.	2	Sports
103307	Pakistan swears in 27 more ministers for new cabinet ISLAMABAD (AFP) -- Pakistani President Pervez Musharraf on Saturday swore in another 27 ministers  three days after inducting a 32-member cabinet headed by newly elected Prime Minister Shaukat Aziz  officials said.	3	World
109021	Japan cleans up as deadliest typhoon in decade kills at least 54 (AFP) AFP - Japan teams are searching for survivors after the country's deadliest typhoon in more than a decade killed at least 54 people as it crushed houses  overturned trains and left passengers stranded on flooded highways.	3	World
77531	Florida Marlins Team Report - September 14 (Sports Network) - The Florida Marlins continue their pursuit of the National League wild card spot  as they continue a five-game series against the Montreal Expos.	2	Sports
178	Your view: Should baby Charlotte be allowed to die? A High Court judge has ruled that doctors can allow to let a seriously ill baby to die if she stops breathing again. The parents of 11-month-old Charlotte Wyatt  who was born three months premature  asked 	3	World
115969	TI OKs \$1 Billion Stock Buyback Texas Instruments Inc. authorized a \$1 billion stock repurchase and increased its quarterly dividend to 2.5 cents from 2.125 cents.	0	Business
10944	Ouch! Yankees hit new low INDIANS 22  YANKEES 0---At New York  Omar Vizquel went 6-for-7 to tie the American League record for hits as Cleveland handed the Yankees the largest loss in their history last night.	2	Sports
35040	Hedge Fund Is Censured and Ordered to Pay Taxes A federal judge ruled Friday against Long-Term Capital Management  finding that the fund acted in bad faith when it took \$106 million in tax deductions.	0	Business
100092	Union threatens Zimbabwe blockade after deportation South Africa #39;s main labour federation is threatening to blockade a border crossing with Zimbabwe after President Robert Mugabe #39;s Government deported a union fact-finding team accused of aiding his enemies.	3	World
35390	Delegates gather for Darfur peace talks ABUJA (AFP) - Sudanese rebels and government envoys began arriving here on Thursday to restart talks to end the conflict in their country #39;s western province of Darfur  as the African Union confirmed it will multiply its truce-monitoring force in the 	3	World
81112	DirecTV Reorganizes Latin American Satellite Business (Update4) Rupert Murdoch #39;s DirecTV Group Inc. will pay \$579 million to consolidate its Latin American operations with other Murdoch-controlled satellite-television businesses in Brazil  Mexico  Colombia and Chile.	0	Business
40399	Henry helps Arsenal put faulty run behind them To paraphrase Basil Fawlty in the memorable sketch about Germans  Arsne Wenger did it once and got away with it. The Arsenal manager dropped Jens Lehmann for the 	2	Sports
96481	Great White Shark Gets Satellite Tracker (AP) AP - Researchers put a satellite tracking device on a 15-foot shark that appeared to be lost in shallow water off Cape Cod  the first time a great white has been tagged that way in the Atlantic.	1	Sci/Tech
4599	Sharapova steamrolls into Seoul semis Seoul  Korea (Sports Network) - Wimbledon champion Maria Sharapova was an easy quarterfinal winner Friday at the \$140 000 Korea Open Tennis Championships.	2	Sports
4613	Schalke  Stuttgart Aim to Topple Wolfsburg With the Bundesliga tightening at the top of the table  a resurgent Schalke 04 will take on a flagging VfB Stuttgart on Saturday. VfL Wolfsburg will try to fend off both teams as the league leader hosts Mainz 05.	2	Sports
58133	Clippers Defeat Warriors  103-91 (AP) AP - Elton Brand scored six of his 25 points in the final four minutes and finished with 13 rebounds  leading the Los Angeles Clippers to a 103-91 victory over the Golden State Warriors on Sunday.	2	Sports
